{
  "schema_version": "1.2",
  "logic_version": "cycle-engine-v5-2026-07-31",
  "methodology_version": "semiconductor-cycle-ai-roles-2026-07-18",
  "evidence_sha256": "4f53cda18c2baa0c0354bb5f9a3ecbe5ed12ab4d8e11ba873c2f11161202b945",
  "report_id": "semiconductor-cycle-2026-10-17-0902-weekly",
  "generated_at": "2026-10-17T09:02:24+09:00",
  "expires_at": "2026-10-25T09:02:24+09:00",
  "fallback_status": "pending-neutral",
  "update_context": {
    "type": "weekly",
    "critical": false,
    "event_ids": [],
    "status_changes": [],
    "reason": "토요일 정기 전체 조사"
  },
  "quality_gate": {
    "status": "insufficient",
    "mode": "verified-only",
    "evidence_count": 0,
    "message": "검증된 최신 근거가 없어 모든 세그먼트를 중립으로 유지합니다."
  },
  "segments": [
    {
      "order": "01",
      "id": "cloud_capex",
      "label": "클라우드 설비투자",
      "status": "neutral",
      "confidence": 25,
      "horizon_months": "3-6",
      "reason": "근거가 부족하거나 상충해 중립을 유지합니다.",
      "supporting_evidence_ids": [],
      "contrary_evidence_ids": []
    },
    {
      "order": "02",
      "id": "ai_compute_design",
      "label": "AI 연산·칩 설계",
      "status": "neutral",
      "confidence": 25,
      "horizon_months": "3-6",
      "reason": "근거가 부족하거나 상충해 중립을 유지합니다.",
      "supporting_evidence_ids": [],
      "contrary_evidence_ids": []
    },
    {
      "order": "03",
      "id": "memory_hbm_dram",
      "label": "HBM·DRAM",
      "status": "neutral",
      "confidence": 25,
      "horizon_months": "3-6",
      "reason": "근거가 부족하거나 상충해 중립을 유지합니다.",
      "supporting_evidence_ids": [],
      "contrary_evidence_ids": []
    },
    {
      "order": "04",
      "id": "memory_nand",
      "label": "NAND",
      "status": "neutral",
      "confidence": 25,
      "horizon_months": "3-6",
      "reason": "근거가 부족하거나 상충해 중립을 유지합니다.",
      "supporting_evidence_ids": [],
      "contrary_evidence_ids": []
    },
    {
      "order": "05",
      "id": "foundry_logic",
      "label": "파운드리·로직",
      "status": "neutral",
      "confidence": 25,
      "horizon_months": "3-6",
      "reason": "근거가 부족하거나 상충해 중립을 유지합니다.",
      "supporting_evidence_ids": [],
      "contrary_evidence_ids": []
    },
    {
      "order": "06",
      "id": "equipment_materials",
      "label": "장비·소부장",
      "status": "neutral",
      "confidence": 25,
      "horizon_months": "3-6",
      "reason": "근거가 부족하거나 상충해 중립을 유지합니다.",
      "supporting_evidence_ids": [],
      "contrary_evidence_ids": []
    },
    {
      "order": "07",
      "id": "analog_auto_industrial",
      "label": "아날로그·자동차·산업용",
      "status": "neutral",
      "confidence": 25,
      "horizon_months": "3-6",
      "reason": "근거가 부족하거나 상충해 중립을 유지합니다.",
      "supporting_evidence_ids": [],
      "contrary_evidence_ids": []
    },
    {
      "order": "08",
      "id": "power_infrastructure",
      "label": "전력·데이터센터 인프라",
      "status": "neutral",
      "confidence": 25,
      "horizon_months": "3-6",
      "reason": "근거가 부족하거나 상충해 중립을 유지합니다.",
      "supporting_evidence_ids": [],
      "contrary_evidence_ids": []
    },
    {
      "order": "09",
      "id": "ai_services",
      "label": "AI 모델·서비스",
      "status": "neutral",
      "confidence": 25,
      "horizon_months": "3-6",
      "reason": "근거가 부족하거나 상충해 중립을 유지합니다.",
      "supporting_evidence_ids": [],
      "contrary_evidence_ids": []
    }
  ],
  "company_map_version": "company-cycle-map-v1-2026-07-19",
  "company_cycle": [
    {
      "ticker": "005930",
      "name": "삼성전자",
      "status": "neutral",
      "label": "사이클 중립",
      "confidence": 25,
      "primary_segment": "memory_hbm_dram",
      "reason": "주요 영역인 HBM·DRAM의 근거가 부족하거나 상충합니다.",
      "exposures": [
        {
          "segment": "memory_hbm_dram",
          "weight": 0.45
        },
        {
          "segment": "foundry_logic",
          "weight": 0.35
        },
        {
          "segment": "memory_nand",
          "weight": 0.2
        }
      ]
    },
    {
      "ticker": "000660",
      "name": "SK하이닉스",
      "status": "neutral",
      "label": "사이클 중립",
      "confidence": 25,
      "primary_segment": "memory_hbm_dram",
      "reason": "주요 영역인 HBM·DRAM의 근거가 부족하거나 상충합니다.",
      "exposures": [
        {
          "segment": "memory_hbm_dram",
          "weight": 0.75
        },
        {
          "segment": "memory_nand",
          "weight": 0.25
        }
      ]
    },
    {
      "ticker": "042700",
      "name": "한미반도체",
      "status": "neutral",
      "label": "사이클 중립",
      "confidence": 25,
      "primary_segment": "equipment_materials",
      "reason": "주요 영역인 장비·소부장의 근거가 부족하거나 상충합니다.",
      "exposures": [
        {
          "segment": "equipment_materials",
          "weight": 1.0
        }
      ]
    },
    {
      "ticker": "NVDA",
      "name": "엔비디아",
      "status": "neutral",
      "label": "사이클 중립",
      "confidence": 25,
      "primary_segment": "ai_compute_design",
      "reason": "주요 영역인 AI 연산·칩 설계의 근거가 부족하거나 상충합니다.",
      "exposures": [
        {
          "segment": "ai_compute_design",
          "weight": 1.0
        }
      ]
    },
    {
      "ticker": "AVGO",
      "name": "브로드컴",
      "status": "neutral",
      "label": "사이클 중립",
      "confidence": 25,
      "primary_segment": "ai_compute_design",
      "reason": "주요 영역인 AI 연산·칩 설계의 근거가 부족하거나 상충합니다.",
      "exposures": [
        {
          "segment": "ai_compute_design",
          "weight": 0.75
        },
        {
          "segment": "cloud_capex",
          "weight": 0.25
        }
      ]
    },
    {
      "ticker": "MU",
      "name": "마이크론",
      "status": "neutral",
      "label": "사이클 중립",
      "confidence": 25,
      "primary_segment": "memory_hbm_dram",
      "reason": "주요 영역인 HBM·DRAM의 근거가 부족하거나 상충합니다.",
      "exposures": [
        {
          "segment": "memory_hbm_dram",
          "weight": 0.65
        },
        {
          "segment": "memory_nand",
          "weight": 0.35
        }
      ]
    },
    {
      "ticker": "AMD",
      "name": "AMD",
      "status": "neutral",
      "label": "사이클 중립",
      "confidence": 25,
      "primary_segment": "ai_compute_design",
      "reason": "주요 영역인 AI 연산·칩 설계의 근거가 부족하거나 상충합니다.",
      "exposures": [
        {
          "segment": "ai_compute_design",
          "weight": 0.8
        },
        {
          "segment": "foundry_logic",
          "weight": 0.2
        }
      ]
    },
    {
      "ticker": "TSM",
      "name": "TSMC",
      "status": "neutral",
      "label": "사이클 중립",
      "confidence": 25,
      "primary_segment": "foundry_logic",
      "reason": "주요 영역인 파운드리·로직의 근거가 부족하거나 상충합니다.",
      "exposures": [
        {
          "segment": "foundry_logic",
          "weight": 1.0
        }
      ]
    },
    {
      "ticker": "INTC",
      "name": "인텔",
      "status": "neutral",
      "label": "사이클 중립",
      "confidence": 25,
      "primary_segment": "foundry_logic",
      "reason": "주요 영역인 파운드리·로직의 근거가 부족하거나 상충합니다.",
      "exposures": [
        {
          "segment": "foundry_logic",
          "weight": 0.7
        },
        {
          "segment": "ai_compute_design",
          "weight": 0.3
        }
      ]
    },
    {
      "ticker": "AMAT",
      "name": "어플라이드 머티어리얼즈",
      "status": "neutral",
      "label": "사이클 중립",
      "confidence": 25,
      "primary_segment": "equipment_materials",
      "reason": "주요 영역인 장비·소부장의 근거가 부족하거나 상충합니다.",
      "exposures": [
        {
          "segment": "equipment_materials",
          "weight": 1.0
        }
      ]
    },
    {
      "ticker": "LRCX",
      "name": "램리서치",
      "status": "neutral",
      "label": "사이클 중립",
      "confidence": 25,
      "primary_segment": "equipment_materials",
      "reason": "주요 영역인 장비·소부장의 근거가 부족하거나 상충합니다.",
      "exposures": [
        {
          "segment": "equipment_materials",
          "weight": 1.0
        }
      ]
    },
    {
      "ticker": "ASML",
      "name": "ASML",
      "status": "neutral",
      "label": "사이클 중립",
      "confidence": 25,
      "primary_segment": "equipment_materials",
      "reason": "주요 영역인 장비·소부장의 근거가 부족하거나 상충합니다.",
      "exposures": [
        {
          "segment": "equipment_materials",
          "weight": 1.0
        }
      ]
    },
    {
      "ticker": "8035",
      "name": "도쿄일렉트론",
      "status": "neutral",
      "label": "사이클 중립",
      "confidence": 25,
      "primary_segment": "equipment_materials",
      "reason": "주요 영역인 장비·소부장의 근거가 부족하거나 상충합니다.",
      "exposures": [
        {
          "segment": "equipment_materials",
          "weight": 1.0
        }
      ]
    },
    {
      "ticker": "MSFT",
      "name": "마이크로소프트",
      "status": "neutral",
      "label": "사이클 중립",
      "confidence": 25,
      "primary_segment": "cloud_capex",
      "reason": "주요 영역인 클라우드 설비투자의 근거가 부족하거나 상충합니다.",
      "exposures": [
        {
          "segment": "cloud_capex",
          "weight": 0.6
        },
        {
          "segment": "ai_services",
          "weight": 0.4
        }
      ]
    },
    {
      "ticker": "GOOGL",
      "name": "구글",
      "status": "neutral",
      "label": "사이클 중립",
      "confidence": 25,
      "primary_segment": "cloud_capex",
      "reason": "주요 영역인 클라우드 설비투자의 근거가 부족하거나 상충합니다.",
      "exposures": [
        {
          "segment": "cloud_capex",
          "weight": 0.55
        },
        {
          "segment": "ai_services",
          "weight": 0.45
        }
      ]
    },
    {
      "ticker": "META",
      "name": "메타",
      "status": "neutral",
      "label": "사이클 중립",
      "confidence": 25,
      "primary_segment": "cloud_capex",
      "reason": "주요 영역인 클라우드 설비투자의 근거가 부족하거나 상충합니다.",
      "exposures": [
        {
          "segment": "cloud_capex",
          "weight": 0.7
        },
        {
          "segment": "ai_services",
          "weight": 0.3
        }
      ]
    },
    {
      "ticker": "ORCL",
      "name": "오라클",
      "status": "neutral",
      "label": "사이클 중립",
      "confidence": 25,
      "primary_segment": "cloud_capex",